{
  "A5": "blocked",
  "a5_preflight_id": "open_macro_v03_a5_preflight_001",
  "allocator_publish": false,
  "allow_allocator_publish": false,
  "allow_db_write": false,
  "artifact_uri": "artifact://runtime/open_macro_v03_runtime_skeleton_001/result-identity-drift-001",
  "calibration_config_sha256": "869e392bd49c8f7e0bf60890d1658ef3cf0483655af3a1c9f105b99cd29c268c",
  "calibration_id": "open_macro_v03_calibration_001",
  "calibration_pack_changes": "none",
  "contract_v1_changes": "none",
  "correlation_id": "corr-open-macro-v03-runtime-skeleton-001",
  "db_write_official": false,
  "docker_execution_from_backend": false,
  "engine_commit": "ee39adbe6cb6541d4fdfa78f1428478ffffaf638",
  "engine_image_digest": "sha256:cdcf05768ad6e44543567cd0b5106ecc2b88a2f49ef5080c25c52a601a91598b",
  "execution_id": "exec-open-macro-v03-runtime-skeleton-001",
  "failure_class": "identity_drift",
  "feature_flag_default": false,
  "feature_flag_name": "open_macro_v03_runtime_activation",
  "formula_changes": "none",
  "freeze_ready": false,
  "input_pack_changes": "none",
  "input_pack_id": "open_macro_v03_certified_input_pack_001",
  "input_pack_sha256": "ae8b76e5959cb5e9c10ced7b33fc13a01a3484865deeead56c5b83b1c440e08f",
  "observed_calibration_config_sha256": "1111111111111111111111111111111111111111111111111111111111111111",
  "observed_calibration_id": "open_macro_v03_calibration_drifted",
  "observed_engine_commit": "2222222222222222222222222222222222222222",
  "observed_engine_image_digest": "sha256:3333333333333333333333333333333333333333333333333333333333333333",
  "observed_input_pack_id": "open_macro_v03_certified_input_pack_drifted",
  "observed_input_pack_sha256": "0000000000000000000000000000000000000000000000000000000000000000",
  "official_result": false,
  "production_endpoint_activation": "none",
  "request_id": "req-open-macro-v03-runtime-skeleton-001",
  "result_mode": "artifact_only_inert_manifest",
  "runtime_activation": false,
  "runtime_skeleton_id": "open_macro_v03_runtime_skeleton_001",
  "schema_version": 1,
  "status": "rejected",
  "strategy": "open_macro_v03"
}
