{
  "A5": "blocked",
  "a5_preflight_id": "open_macro_v03_a5_preflight_001",
  "allocator_publish": false,
  "allow_allocator_publish": false,
  "allow_db_write": false,
  "artifact_uri": "artifact://runtime/open_macro_v03_runtime_skeleton_001/result-001",
  "calibration_pack_changes": "none",
  "contract_v1_changes": "none",
  "correlation_id": "corr-open-macro-v03-runtime-skeleton-001",
  "db_write_official": false,
  "docker_execution_from_backend": false,
  "execution_id": "exec-open-macro-v03-runtime-skeleton-001",
  "feature_flag_default": false,
  "feature_flag_name": "open_macro_v03_runtime_activation",
  "formula_changes": "none",
  "freeze_ready": false,
  "input_pack_changes": "none",
  "official_result": false,
  "production_endpoint_activation": "none",
  "request_id": "req-open-macro-v03-runtime-skeleton-001",
  "result_mode": "artifact_only_inert_manifest",
  "runtime_activation": false,
  "runtime_skeleton_id": "open_macro_v03_runtime_skeleton_001",
  "schema_version": 1,
  "status": "not_executed",
  "strategy": "open_macro_v03"
}
